{
  "schema_version": 1,
  "generated_at": "2026-10-31T12:07:35Z",
  "stats": {
    "total_items": 33,
    "published": 12,
    "done": 0,
    "review": 2,
    "wip": 2,
    "open": 17,
    "na": 0,
    "untouched": 21
  },
  "groups": [
    {
      "type": "pathway",
      "slug": "user",
      "label": "Start using WordPress",
      "courses": [
        {
          "slug": "beginner-wordpress-user",
          "label": "Beginner WordPress User",
          "sections": [
            {
              "slug": "get-started-with-wordpress",
              "label": "Get Started With WordPress",
              "items": [
                {
                  "type": "lesson",
                  "slug": "introduction-to-wordpress-2",
                  "title_en": "Introduction to WordPress",
                  "url_en": "https://learn.wordpress.org/lesson/introduction-to-wordpress-2/",
                  "issue": {
                    "number": 2742,
                    "url": "https://github.com/WordPress/Learn/issues/2742",
                    "state": "closed",
                    "assignees": [
                      "rfluethi",
                      "BenjaminZekavica"
                    ],
                    "project_status": "Published or Closed"
                  },
                  "url_de": "https://learn.wordpress.org/lesson/einfuhrung-in-wordpress/",
                  "title_de": "Einführung in WordPress",
                  "url_wptv_en": "https://wordpress.tv/2023/12/06/introduction-to-wordpress/",
                  "url_wptv_de": "https://wordpress.tv/2024/10/14/einfuhrung-in-wordpress/",
                  "url_wptv": "https://wordpress.tv/2024/10/14/einfuhrung-in-wordpress/",
                  "url_youtube_en": "https://www.youtube.com/watch?v=3S-s_V_z8JQ",
                  "url_youtube_de": "https://www.youtube.com/watch?v=hDwmD2hoVrA",
                  "url_youtube": "https://www.youtube.com/watch?v=hDwmD2hoVrA",
                  "components": [
                    {
                      "name": "thumbnails",
                      "status": "done",
                      "creator": "rfluethi",
                      "reviewer": "BenjaminZekavica"
                    },
                    {
                      "name": "text",
                      "status": "done",
                      "creator": "rfluethi",
                      "reviewer": "BenjaminZekavica"
                    },
                    {
                      "name": "subtitles",
                      "status": "done",
                      "creator": "rfluethi",
                      "reviewer": "BenjaminZekavica"
                    },
                    {
                      "name": "exercise",
                      "status": "na"
                    },
                    {
                      "name": "quiz",
                      "status": "done",
                      "creator": "rfluethi",
                      "reviewer": "BenjaminZekavica"
                    },
                    {
                      "name": "audio",
                      "status": "done",
                      "creator": "rfluethi",
                      "reviewer": "BenjaminZekavica"
                    },
                    {
                      "name": "video",
                      "status": "done",
                      "creator": "rfluethi",
                      "reviewer": "BenjaminZekavica"
                    }
                  ],
                  "overall_status": "published"
                },
                {
                  "type": "lesson",
                  "slug": "wordpress-essentials-domains-and-hosting",
                  "title_en": "WordPress essentials: Domains and hosting",
                  "url_en": "https://learn.wordpress.org/lesson/wordpress-essentials-domains-and-hosting/",
                  "issue": {
                    "number": 2955,
                    "url": "https://github.com/WordPress/Learn/issues/2955",
                    "state": "closed",
                    "assignees": [
                      "rfluethi",
                      "Ursha-wp"
                    ],
                    "project_status": "Published or Closed"
                  },
                  "url_de": "https://learn.wordpress.org/lesson/wordpress-grundlagen-domains-und-hosting/",
                  "title_de": "WordPress-Grundlagen: Domains und Hosting",
                  "url_wptv_en": "https://wordpress.tv/2023/12/07/wordpress-essentials-domains-and-hosting/",
                  "url_wptv_de": "https://wordpress.tv/2025/11/18/wordpress-grundlagen-domains-und-hosting/",
                  "url_wptv": "https://wordpress.tv/2025/11/18/wordpress-grundlagen-domains-und-hosting/",
                  "url_youtube_en": "https://www.youtube.com/watch?v=stbR6Tf7tCg",
                  "url_youtube_de": "https://www.youtube.com/watch?v=Vj3pFHoFSTY",
                  "url_youtube": "https://www.youtube.com/watch?v=Vj3pFHoFSTY",
                  "components": [
                    {
                      "name": "thumbnails",
                      "status": "done",
                      "creator": "rfluethi",
                      "reviewer": "Ursha-wp"
                    },
                    {
                      "name": "text",
                      "status": "done",
                      "creator": "rfluethi",
                      "reviewer": "Ursha-wp"
                    },
                    {
                      "name": "subtitles",
                      "status": "done",
                      "creator": "rfluethi",
                      "reviewer": "Ursha-wp"
                    },
                    {
                      "name": "exercise",
                      "status": "na"
                    },
                    {
                      "name": "quiz",
                      "status": "done",
                      "creator": "rfluethi",
                      "reviewer": "Ursha-wp"
                    },
                    {
                      "name": "audio",
                      "status": "done",
                      "creator": "Ursha-wp",
                      "reviewer": "rfluethi"
                    },
                    {
                      "name": "video",
                      "status": "done",
                      "creator": "rfluethi",
                      "reviewer": "Ursha-wp"
                    }
                  ],
                  "overall_status": "published"
                },
                {
                  "type": "lesson",
                  "slug": "choosing-and-installing-a-theme",
                  "title_en": "Choosing and installing a theme",
                  "url_en": "https://learn.wordpress.org/lesson/choosing-and-installing-a-theme/",
                  "issue": {
                    "number": 3170,
                    "url": "https://github.com/WordPress/Learn/issues/3170",
                    "state": "open",
                    "assignees": [
                      "rfluethi",
                      "Chris-Ober"
                    ],
                    "project_status": "Ready for Review"
                  },
                  "components": [
                    {
                      "name": "thumbnails",
                      "status": "unset"
                    },
                    {
                      "name": "text",
                      "status": "unset"
                    },
                    {
                      "name": "subtitles",
                      "status": "unset"
                    },
                    {
                      "name": "exercise",
                      "status": "unset"
                    },
                    {
                      "name": "quiz",
                      "status": "unset"
                    },
                    {
                      "name": "audio",
                      "status": "unset"
                    },
                    {
                      "name": "video",
                      "status": "unset"
                    }
                  ],
                  "overall_status": "review"
                },
                {
                  "type": "lesson",
                  "slug": "choosing-and-installing-a-plugin",
                  "title_en": "Choosing and installing a plugin",
                  "url_en": "https://learn.wordpress.org/lesson/choosing-and-installing-a-plugin/",
                  "issue": {
                    "number": 3174,
                    "url": "https://github.com/WordPress/Learn/issues/3174",
                    "state": "open",
                    "assignees": [
                      "Bigod",
                      "rfluethi"
                    ],
                    "project_status": "Published or Closed"
                  },
                  "url_de": "https://learn.wordpress.org/lesson/auswahl-und-installation-von-plugins/",
                  "title_de": "Auswahl und Installation von Plugins",
                  "url_wptv_en": "https://wordpress.tv/2024/02/13/choosing-and-installing-a-plugin-2/",
                  "url_youtube_en": "https://www.youtube.com/watch?v=WooNmrNKmcM",
                  "components": [
                    {
                      "name": "thumbnails",
                      "status": "open"
                    },
                    {
                      "name": "text",
                      "status": "done",
                      "creator": "Bigod",
                      "reviewer": "rfluethi"
                    },
                    {
                      "name": "subtitles",
                      "status": "open"
                    },
                    {
                      "name": "exercise",
                      "status": "open"
                    },
                    {
                      "name": "quiz",
                      "status": "done",
                      "creator": "Bigod",